### ISSUE TITLE
Connection Issue - "Invalid Server Credentials"

### ISSUE THREAD

**Issue by farbod-s** [Jigsaw-Code/outline-server#1605]
**Description**:
I'm encountering a persistent connection issue when trying to connect to my Outline server hosted on a VPS. The Outline client app displays an error message: "Invalid Server Credentials".

**Steps to Reproduce**:
Install Outline on a VPS with SSH access.
Configure the Outline server and generate a user key.
Attempt to connect to the Outline server using the Outline client application.

**Expected Behavior**:
The Outline client should connect successfully to the server without any errors.

**Actual Behavior**:
The Outline client fails to connect, displaying the error message: "Invalid Server Credentials".

---

**Additional Info, Logs and Diagnostics**:

1. Experimental Server Connectivity Test

URL: https://fortuna-outline-connectivity.netlify.app

<img width="362" alt="Screenshot 1403-07-12 at 19 13 23" src="https://github.com/user-attachments/assets/6774f41f-12a9-40a7-a643-f14b932db779">

2. Installation Command:

```sh
root:~# sudo bash -c "$(wget -qO- https://raw.githubusercontent.com/Jigsaw-Code/outline-server/master/src/server_manager/install_scripts/install_server.sh)"
```

3. Basic System Information (VPS):

```
Memory: 2 GB
Disk Size: 40 GB
CPU Number: 2
Image: Ubuntu 24.04.1 LTS
Architecture: AMD x86_64
```

4. Firewall Status (VPS):

```sh
root:~# sudo ufw status

Status: active

To                         Action      From
--                         ------      ----
Anywhere                   DENY        10.0.0.0/8                
Anywhere                   DENY        172.0.0.0/8               
Anywhere                   DENY        185.232.0.0/14            
Anywhere                   DENY        192.0.0.0/8               
Anywhere                   DENY        102.0.0.0/8               
Anywhere                   DENY        198.0.0.0/8               
22/tcp                     ALLOW       Anywhere                  
1024:65535/tcp             ALLOW       Anywhere                  
1024:65535/udp             ALLOW       Anywhere                  
43/tcp                     ALLOW       Anywhere                  
43/udp                     ALLOW       Anywhere                  
443/tcp                    ALLOW       Anywhere                  
443/udp                    ALLOW       Anywhere                  
XXXXX/tcp                  ALLOW       Anywhere                  
XXXXX/udp                  ALLOW       Anywhere                  
```

5. Traceroute Output (Client):

```sh
~ sudo traceroute -P tcp -p $PORT_NUMBER $IP_ADDRESS

traceroute to $IP_ADDRESS ($IP_ADDRESS), 64 hops max, 40 byte packets
1  homerouter.cpe (192.168.1.1)  2.402 ms  1.953 ms  2.023 ms
2  * * *
...
25  static.XXX.XX.XX.X.clients.your-server.de ($IP_ADDRESS)  259.792 ms
```

6. Telnet Connection (Client):

```sh
~ telnet $IP_ADDRESS $PORT_NUMBER

Trying $IP_ADDRESS...
Connected to static.XXX.XX.XX.X.clients.your-server.de.
Escape character is '^]'.
```

7. Client and Server Handshake with Netstat:

```sh
~ sudo tcpdump -i en0 host X.XX.XX.XXX and port XXXXX

listening on en0, link-type EN10MB (Ethernet), snapshot length 524288 bytes
18:14:27.611777 IP YY-YY-YY-YY-YY-YY.59886 > static.XXX.XX.XX.X.clients.your-server.de.XXXXX: Flags [S], seq 2346747561, win 65535, options [mss 1460,nop,wscale 6,nop,nop,TS val 3921945363 ecr 0,sackOK,eol], length 0
18:14:27.623771 IP YY-YY-YY-YY-YY-YY.64116 > static.XXX.XX.XX.X.clients.your-server.de.XXXXX: UDP, length 76
18:14:27.893363 IP static.XXX.XX.XX.X.clients.your-server.de.XXXXX > YY-YY-YY-YY-YY-YY.59886: Flags [S.], seq 962902509, ack 2346747562, win 65160, options [mss 1400,sackOK,TS val 85378769 ecr 3921945363,nop,wscale 7], length 0
18:14:27.893591 IP YY-YY-YY-YY-YY-YY.59886 > static.XXX.XX.XX.X.clients.your-server.de.XXXXX: Flags [.], ack 1, win 2060, options [nop,nop,TS val 3921945645 ecr 85378769], length 0
18:14:27.894193 IP YY-YY-YY-YY-YY-YY.59886 > static.XXX.XX.XX.X.clients.your-server.de.XXXXX: Flags [P.], seq 1:152, ack 1, win 2060, options [nop,nop,TS val 3921945645 ecr 85378769], length 151
18:14:27.903334 IP static.XXX.XX.XX.X.clients.your-server.de.XXXXX > YY-YY-YY-YY-YY-YY.64116: UDP, length 149
18:14:28.170557 IP static.XXX.XX.XX.X.clients.your-server.de.XXXXX > YY-YY-YY-YY-YY-YY.59886: Flags [.], ack 152, win 508, options [nop,nop,TS val 85379055 ecr 3921945645], length 0
18:14:37.612811 IP YY-YY-YY-YY-YY-YY.59886 > static.XXX.XX.XX.X.clients.your-server.de.XXXXX: Flags [F.], seq 152, ack 1, win 2060, options [nop,nop,TS val 3921955365 ecr 85379055], length 0
18:14:38.158280 IP YY-YY-YY-YY-YY-YY.59886 > static.XXX.XX.XX.X.clients.your-server.de.XXXXX: Flags [F.], seq 152, ack 1, win 2060, options [nop,nop,TS val 3921955910 ecr 85379055], length 0
18:14:39.046926 IP YY-YY-YY-YY-YY-YY.59886 > static.XXX.XX.XX.X.clients.your-server.de.XXXXX: Flags [F.], seq 152, ack 1, win 2060, options [nop,nop,TS val 3921956799 ecr 85379055], length 0
18:14:40.623795 IP YY-YY-YY-YY-YY-YY.59886 > static.XXX.XX.XX.X.clients.your-server.de.XXXXX: Flags [F.], seq 152, ack 1, win 2060, options [nop,nop,TS val 3921958375 ecr 85379055], length 0
18:14:43.171062 IP YY-YY-YY-YY-YY-YY.59886 > static.XXX.XX.XX.X.clients.your-server.de.XXXXX: Flags [.], ack 1, win 2060, length 0
18:14:43.577633 IP YY-YY-YY-YY-YY-YY.59886 > static.XXX.XX.XX.X.clients.your-server.de.XXXXX: Flags [F.], seq 152, ack 1, win 2060, options [nop,nop,TS val 3921961329 ecr 85379055], length 0

---

root:~# sudo tcpdump -i any port XXXXX

tcpdump: data link type LINUX_SLL2
tcpdump: verbose output suppressed, use -v[v]... for full protocol decode
listening on any, link-type LINUX_SLL2 (Linux cooked v2), snapshot length 262144 bytes
14:44:28.099179 eth0  In  IP XX.XX.XXX.XXX.46850 > static.XXX.XX.XX.X.clients.your-server.de.XXXXX: Flags [S], seq 2346747561, win 65535, options [mss 1400,nop,wscale 6,nop,nop,TS val 3921945363 ecr 0,sackOK,eol], length 0
14:44:28.099240 eth0  Out IP static.XXX.XX.XX.X.clients.your-server.de.XXXXX > XX.XX.XXX.XXX.46850: Flags [S.], seq 962902509, ack 2346747562, win 65160, options [mss 1460,sackOK,TS val 85378769 ecr 3921945363,nop,wscale 7], length 0
14:44:28.104730 eth0  In  IP XX.XX.XXX.XXX.57384 > static.XXX.XX.XX.X.clients.your-server.de.XXXXX: UDP, length 76
14:44:28.108047 eth0  Out IP static.XXX.XX.XX.X.clients.your-server.de.XXXXX > XX.XX.XXX.XXX.57384: UDP, length 149
14:44:28.384187 eth0  In  IP XX.XX.XXX.XXX.46850 > static.XXX.XX.XX.X.clients.your-server.de.XXXXX: Flags [.], ack 1, win 2060, options [nop,nop,TS val 3921945645 ecr 85378769], length 0
14:44:28.385136 eth0  In  IP XX.XX.XXX.XXX.46850 > static.XXX.XX.XX.X.clients.your-server.de.XXXXX: Flags [P.], seq 1:152, ack 1, win 2060, options [nop,nop,TS val 3921945645 ecr 85378769], length 151
14:44:28.385162 eth0  Out IP static.XXX.XX.XX.X.clients.your-server.de.XXXXX > XX.XX.XXX.XXX.46850: Flags [.], ack 152, win 508, options [nop,nop,TS val 85379055 ecr 3921945645], length 0
14:44:28.395191 eth0  Out IP static.XXX.XX.XX.X.clients.your-server.de.XXXXX > XX.XX.XXX.XXX.46850: Flags [P.], seq 1:397, ack 152, win 508, options [nop,nop,TS val 85379065 ecr 3921945645], length 396
14:44:29.180931 eth0  Out IP static.XXX.XX.XX.X.clients.your-server.de.XXXXX > XX.XX.XXX.XXX.46850: Flags [P.], seq 1:397, ack 152, win 508, options [nop,nop,TS val 85379851 ecr 3921945645], length 396
14:44:30.140938 eth0  Out IP static.XXX.XX.XX.X.clients.your-server.de.XXXXX > XX.XX.XXX.XXX.46850: Flags [P.], seq 1:397, ack 152, win 508, options [nop,nop,TS val 85380811 ecr 3921945645], length 396
14:44:30.780985 eth0  Out IP static.XXX.XX.XX.X.clients.your-server.de.XXXXX > XX.XX.XXX.XXX.27634: Flags [FP.], seq 4168854450:4168854873, ack 12506134, win 508, options [nop,nop,TS val 85381451 ecr 3925605765], length 423
14:44:32.060936 eth0  Out IP static.XXX.XX.XX.X.clients.your-server.de.XXXXX > XX.XX.XXX.XXX.46850: Flags [P.], seq 1:397, ack 152, win 508, options [nop,nop,TS val 85382731 ecr 3921945645], length 396
14:44:34.876963 eth0  Out IP static.XXX.XX.XX.X.clients.your-server.de.XXXXX > XX.XX.XXX.XXX.56239: Flags [FP.], seq 2994815823:2994816224, ack 3443131560, win 508, options [nop,nop,TS val 85385547 ecr 537659670], length 401
14:44:35.900938 eth0  Out IP static.XXX.XX.XX.X.clients.your-server.de.XXXXX > XX.XX.XXX.XXX.46850: Flags [P.], seq 1:397, ack 152, win 508, options [nop,nop,TS val 85386571 ecr 3921945645], length 396
14:44:43.580942 eth0  Out IP static.XXX.XX.XX.X.clients.your-server.de.XXXXX > XX.XX.XXX.XXX.46850: Flags [P.], seq 1:397, ack 152, win 508, options [nop,nop,TS val 85394251 ecr 3921945645], length 396
14:44:58.940959 eth0  Out IP static.XXX.XX.XX.X.clients.your-server.de.XXXXX > XX.XX.XXX.XXX.46850: Flags [P.], seq 1:397, ack 152, win 508, options [nop,nop,TS val 85409611 ecr 3921945645], length 396
```

8. Docker Status for Shadowbox (VPS)

```sh
root:~# sudo docker ps

CONTAINER ID   IMAGE                              COMMAND                  CREATED       STATUS                 PORTS      NAMES
e5b0d0ffbd57   containrrr/watchtower              "/watchtower --clean…"   7 hours ago   Up 7 hours (healthy)   8080/tcp   watchtower
9c283784e456   quay.io/outline/shadowbox:stable   "docker-entrypoint.s…"   7 hours ago   Up 7 hours                        shadowbox

root:~# sudo docker logs 9c283784e456

I2024-10-03T07:05:09.560Z 12 main.js:2] ======== Outline Server main() ========
I2024-10-03T07:05:09.561Z 12 main.js:2] Version is 1.9.0
I2024-10-03T07:05:09.567Z 12 main.js:2] Hostname: X.XX.XX.XXX
I2024-10-03T07:05:09.568Z 12 main.js:2] SB_METRICS_URL: https://prod.metrics.getoutline.org
(node:12) [DEP0111] DeprecationWarning: Access to process.binding('http_parser') is deprecated.
(Use node --trace-deprecation ... to show where the warning was created)
I2024-10-03T07:05:09.573Z 12 main.js:2] Prometheus is at 127.0.0.1:9090
I2024-10-03T07:05:09.573Z 12 main.js:2] Node metrics is at 127.0.0.1:9091
I2024-10-03T07:05:09.573Z 12 main.js:2] outline-ss-server metrics is at 127.0.0.1:9092
I2024-10-03T07:05:09.574Z 12 main.js:2] Replay protection enabled: true
I2024-10-03T07:05:09.584Z 12 main.js:2] ======== Starting Prometheus ========
I2024-10-03T07:05:09.584Z 12 main.js:2] /opt/outline-server/bin/prometheus "--config.file" "/opt/outline/persisted-state/prometheus/config.yml" "--web.enable-admin-api" "--storage.tsdb.retention.time" "31d" "--storage.tsdb.path" "/opt/outline/persisted-state/prometheus/data" "--web.listen-address" "127.0.0.1:9090" "--log.level" "info"
ts=2024-10-03T07:05:09.623Z caller=main.go:535 level=info msg="Starting Prometheus Server" mode=server version="(version=2.37.1, branch=HEAD, revision=1ce2197e7f9e95089bfb95cb61762b5a89a8c0da)"
ts=2024-10-03T07:05:09.623Z caller=main.go:540 level=info build_context="(go=go1.18.6, user=root, date=20220912-12:42:39)"
ts=2024-10-03T07:05:09.623Z caller=main.go:541 level=info host_details="(Linux 6.8.0-45-generic #45-Ubuntu SMP PREEMPT_DYNAMIC Fri Aug 30 12:02:04 UTC 2024 x86_64 (none))"
ts=2024-10-03T07:05:09.623Z caller=main.go:542 level=info fd_limits="(soft=1048576, hard=1048576)"
ts=2024-10-03T07:05:09.623Z caller=main.go:543 level=info vm_limits="(soft=unlimited, hard=unlimited)"
ts=2024-10-03T07:05:09.627Z caller=web.go:553 level=info component=web msg="Start listening for connections" address=127.0.0.1:9090
ts=2024-10-03T07:05:09.627Z caller=main.go:972 level=info msg="Starting TSDB ..."
ts=2024-10-03T07:05:09.628Z caller=tls_config.go:195 level=info component=web msg="TLS is disabled." http2=false
ts=2024-10-03T07:05:09.631Z caller=head.go:493 level=info component=tsdb msg="Replaying on-disk memory mappable chunks if any"
ts=2024-10-03T07:05:09.631Z caller=head.go:536 level=info component=tsdb msg="On-disk memory mappable chunks replay completed" duration=3.266µs
ts=2024-10-03T07:05:09.631Z caller=head.go:542 level=info component=tsdb msg="Replaying WAL, this may take a while"
ts=2024-10-03T07:05:09.632Z caller=head.go:613 level=info component=tsdb msg="WAL segment loaded" segment=0 maxSegment=0
ts=2024-10-03T07:05:09.632Z caller=head.go:619 level=info component=tsdb msg="WAL replay completed" checkpoint_replay_duration=38.191µs wal_replay_duration=500.15µs total_replay_duration=1.131344ms
ts=2024-10-03T07:05:09.633Z caller=main.go:993 level=info fs_type=EXT4_SUPER_MAGIC
ts=2024-10-03T07:05:09.633Z caller=main.go:996 level=info msg="TSDB started"
ts=2024-10-03T07:05:09.633Z caller=main.go:1177 level=info msg="Loading configuration file" filename=/opt/outline/persisted-state/prometheus/config.yml
ts=2024-10-03T07:05:09.634Z caller=main.go:1214 level=info msg="Completed loading of configuration file" filename=/opt/outline/persisted-state/prometheus/config.yml totalDuration=598.804µs db_storage=580ns remote_storage=1.142µs web_handler=330ns query_engine=751ns scrape=268.344µs scrape_sd=44.624µs notify=1.152µs notify_sd=28.083µs rules=1.673µs tracing=5.671µs
ts=2024-10-03T07:05:09.634Z caller=main.go:957 level=info msg="Server is ready to receive web requests."
ts=2024-10-03T07:05:09.634Z caller=manager.go:941 level=info component="rule manager" msg="Starting rule manager..."
I2024-10-03T07:05:10.601Z 12 main.js:2] Prometheus is ready!
I2024-10-03T07:05:10.655Z 12 main.js:2] Manager listening at https://[::]:XXXXX/YYYYYYYYYYYYYYYYYYYYYY
I2024-10-03T07:05:10.658Z 12 main.js:2] ======== Starting Outline Shadowsocks Service ========
I2024-10-03T07:05:10.658Z 12 main.js:2] /opt/outline-server/bin/outline-ss-server "-config" "/opt/outline/persisted-state/outline-ss-server/config.yml" "-metrics" "127.0.0.1:9092" "-ip_country_db" "/var/lib/libmaxminddb/ip-country.mmdb" "--replay_history=10000"
I2024-10-03T07:05:10.664Z 30 main.go:271] Prometheus metrics available at http://127.0.0.1:9092/metrics
I2024-10-03T07:05:10.664Z 30 main.go:276] Using IP-Country database at /var/lib/libmaxminddb/ip-country.mmdb
I2024-10-03T07:05:10.665Z 30 main.go:166] Loaded 0 access keys over 0 ports
I2024-10-03T07:05:11.375Z 30 main.go:197] SIGHUP received. Loading config from /opt/outline/persisted-state/outline-ss-server/config.yml
I2024-10-03T07:05:11.376Z 30 main.go:81] Shadowsocks TCP service listening on [::]:XXXXX
I2024-10-03T07:05:11.376Z 30 main.go:87] Shadowsocks UDP service listening on [::]:XXXXX
I2024-10-03T07:05:11.376Z 30 main.go:166] Loaded 1 access keys over 1 ports
W2024-10-03T07:37:04.570Z 30 metrics.go:142] Failed to find active client
(node:12) [DEP0005] DeprecationWarning: Buffer() is deprecated due to security and usability issues. Please use the Buffer.alloc(), Buffer.allocUnsafe(), or Buffer.from() methods instead.
W2024-10-03T07:46:27.024Z 30 metrics.go:142] Failed to find active client
ts=2024-10-03T10:05:33.785Z caller=compact.go:519 level=info component=tsdb msg="write block" mint=1727939121998 maxt=1727942400000 ulid=01J98XF365BKKEQ4DN6RRNDNG0 duration=20.635302ms
ts=2024-10-03T10:05:33.786Z caller=head.go:842 level=info component=tsdb msg="Head GC completed" duration=623.766µs
ts=2024-10-03T11:00:22.055Z caller=compact.go:519 level=info component=tsdb msg="write block" mint=1727942421998 maxt=1727949600000 ulid=01J990KEBK3AVQ26AY8NDYBM5E duration=52.147525ms
ts=2024-10-03T11:00:22.057Z caller=head.go:842 level=info component=tsdb msg="Head GC completed" duration=1.075299ms
ts=2024-10-03T13:00:33.800Z caller=compact.go:519 level=info component=tsdb msg="write block" mint=1727949622000 maxt=1727956800000 ulid=01J997FH39F48WKMKD90BEC4Q4 duration=30.985474ms
ts=2024-10-03T13:00:33.801Z caller=head.go:842 level=info component=tsdb msg="Head GC completed" duration=838.509µs
W2024-10-03T14:15:26.525Z 30 metrics.go:142] Failed to find active client
W2024-10-03T14:15:26.715Z 30 metrics.go:142] Failed to find active client
W2024-10-03T14:15:30.131Z 30 metrics.go:142] Failed to find active client
W2024-10-03T14:15:55.537Z 30 metrics.go:142] Failed to find active client
W2024-10-03T14:15:55.554Z 30 metrics.go:142] Failed to find active client
W2024-10-03T14:15:58.116Z 30 metrics.go:142] Failed to find active client
```

**Comment by cornzzy** [comment]
Your server ip has been blocked, or it was already blocked. Get a clean ip and use [prefix](https://www.reddit.com/r/outlinevpn/wiki/index/prefixing/) and you can use it for a week or two.

https://check-host.net/check-ping
https://ping.pe

**Comment by farbod-s** [comment]
@cornzzy Thanks for your suggestions. I checked the IP using the links you provided, and it appears to be clean. Additionally, I was able to install another VPN on the same server without issues. However, adding a prefix to my access keys didn't resolve the issue.
